{
  "totalMarketValue": 28127.984441616747,
  "pillarTotals": {
    "ASI / Compute": 6724.005,
    "Cash": 3965.619441616745,
    "Power / Energy": 2778.1400000000003,
    "Data Infra / Supply Chain": 2908.49,
    "AI Titans / Cloud": 2531.62,
    "Sovereign Finance": 2660.32,
    "Security / Data OS": 1599.5,
    "Applied AI / Robotics": 1452.2399999999998,
    "Other": 3508.05
  },
  "targetAllocations": {
    "ASI / Compute": 32,
    "Cash": 18.66,
    "Power / Energy": 10,
    "Data Infra / Supply Chain": 9.47,
    "AI Titans / Cloud": 9.3,
    "Sovereign Finance": 7.91,
    "Security / Data OS": 7.48,
    "Applied AI / Robotics": 5.18,
    "Other": 0
  },
  "holdings": [
    {
      "symbol": "ZS",
      "name": "",
      "pillar": "Security / Data OS",
      "totalShares": 1,
      "totalBookValue": 276.0118,
      "totalMarketValue": 299.4,
      "avgPrice": 276.0118,
      "pctPortfolio": 1.0644203839825184,
      "targetPct": 7.48,
      "gapPct": -6.415579616017482,
      "accounts": [
        ""
      ]
    },
    {
      "symbol": "VST",
      "name": "",
      "pillar": "Power / Energy",
      "totalShares": 6,
      "totalBookValue": 1188.4092,
      "totalMarketValue": 1260.3000000000002,
      "avgPrice": 198.06820000000002,
      "pctPortfolio": 4.480591215541644,
      "targetPct": 10,
      "gapPct": -5.519408784458356,
      "accounts": [
        ""
      ]
    },
    {
      "symbol": "ANET",
      "name": "",
      "pillar": "Data Infra / Supply Chain",
      "totalShares": 3,
      "totalBookValue": 426.557301,
      "totalMarketValue": 437.97,
      "avgPrice": 142.185767,
      "pctPortfolio": 1.5570614414589967,
      "targetPct": 9.47,
      "gapPct": -7.912938558541004,
      "accounts": [
        ""
      ]
    },
    {
      "symbol": "VRT",
      "name": "",
      "pillar": "Data Infra / Supply Chain",
      "totalShares": 2,
      "totalBookValue": 263.1401,
      "totalMarketValue": 354,
      "avgPrice": 131.57005,
      "pctPortfolio": 1.2585331193380478,
      "targetPct": 9.47,
      "gapPct": -8.211466880661952,
      "accounts": [
        ""
      ]
    },
    {
      "symbol": "MSFT",
      "name": "",
      "pillar": "AI Titans / Cloud",
      "totalShares": 2,
      "totalBookValue": 1023.3687600000001,
      "totalMarketValue": 1021,
      "avgPrice": 511.68438000000003,
      "pctPortfolio": 3.6298370475823356,
      "targetPct": 9.3,
      "gapPct": -5.670162952417665,
      "accounts": [
        ""
      ]
    },
    {
      "symbol": "IBIT",
      "name": "",
      "pillar": "Sovereign Finance",
      "totalShares": 15,
      "totalBookValue": 1020.6705000000001,
      "totalMarketValue": 918.75,
      "avgPrice": 68.0447,
      "pctPortfolio": 3.26632006607862,
      "targetPct": 7.91,
      "gapPct": -4.64367993392138,
      "accounts": [
        ""
      ]
    },
    {
      "symbol": "KOID",
      "name": "",
      "pillar": "Applied AI / Robotics",
      "totalShares": 22,
      "totalBookValue": 682.4848,
      "totalMarketValue": 681.3399999999999,
      "avgPrice": 31.02203636363636,
      "pctPortfolio": 2.422285185112388,
      "targetPct": 5.18,
      "gapPct": -2.7577148148876116,
      "accounts": [
        ""
      ]
    },
    {
      "symbol": "OKLO",
      "name": "",
      "pillar": "Power / Energy",
      "totalShares": 2,
      "totalBookValue": 219.9,
      "totalMarketValue": 324.68,
      "avgPrice": 109.95,
      "pctPortfolio": 1.154295291487789,
      "targetPct": 10,
      "gapPct": -8.84570470851221,
      "accounts": [
        ""
      ]
    },
    {
      "symbol": "CDNS",
      "name": "",
      "pillar": "ASI / Compute",
      "totalShares": 1,
      "totalBookValue": 344.15,
      "totalMarketValue": 323.39,
      "avgPrice": 344.15,
      "pctPortfolio": 1.149709111476642,
      "targetPct": 32,
      "gapPct": -30.850290888523357,
      "accounts": [
        ""
      ]
    },
    {
      "symbol": "AMD",
      "name": "",
      "pillar": "ASI / Compute",
      "totalShares": 2,
      "totalBookValue": 447.01300000000003,
      "totalMarketValue": 466.04,
      "avgPrice": 223.50650000000002,
      "pctPortfolio": 1.6568552964302368,
      "targetPct": 32,
      "gapPct": -30.343144703569763,
      "accounts": [
        ""
      ]
    },
    {
      "symbol": "GOOG",
      "name": "",
      "pillar": "AI Titans / Cloud",
      "totalShares": 6,
      "totalBookValue": 1459.5155,
      "totalMarketValue": 1510.6200000000001,
      "avgPrice": 243.25258333333332,
      "pctPortfolio": 5.370523448402379,
      "targetPct": 9.3,
      "gapPct": -3.929476551597622,
      "accounts": [
        ""
      ]
    },
    {
      "symbol": "NVDA",
      "name": "",
      "pillar": "ASI / Compute",
      "totalShares": 4,
      "totalBookValue": 743.813999,
      "totalMarketValue": 724.84,
      "avgPrice": 185.95349975,
      "pctPortfolio": 2.576935441302233,
      "targetPct": 32,
      "gapPct": -29.423064558697767,
      "accounts": [
        ""
      ]
    },
    {
      "symbol": "AVGO",
      "name": "",
      "pillar": "ASI / Compute",
      "totalShares": 5,
      "totalBookValue": 1711.1098499999998,
      "totalMarketValue": 1761.25,
      "avgPrice": 342.22196999999994,
      "pctPortfolio": 6.261557786537109,
      "targetPct": 32,
      "gapPct": -25.73844221346289,
      "accounts": [
        ""
      ]
    },
    {
      "symbol": "COIN",
      "name": "",
      "pillar": "Sovereign Finance",
      "totalShares": 2,
      "totalBookValue": 768.816,
      "totalMarketValue": 659.32,
      "avgPrice": 384.408,
      "pctPortfolio": 2.344000158875598,
      "targetPct": 7.91,
      "gapPct": -5.565999841124402,
      "accounts": [
        ""
      ]
    },
    {
      "symbol": "CRWD",
      "name": "",
      "pillar": "Security / Data OS",
      "totalShares": 1,
      "totalBookValue": 458.3133,
      "totalMarketValue": 481.1,
      "avgPrice": 458.3133,
      "pctPortfolio": 1.710396281676652,
      "targetPct": 7.48,
      "gapPct": -5.769603718323348,
      "accounts": [
        ""
      ]
    },
    {
      "symbol": "PANW",
      "name": "",
      "pillar": "Security / Data OS",
      "totalShares": 4,
      "totalBookValue": 829.320701,
      "totalMarketValue": 819,
      "avgPrice": 207.33017525,
      "pctPortfolio": 2.911691030332941,
      "targetPct": 7.48,
      "gapPct": -4.56830896966706,
      "accounts": [
        ""
      ]
    },
    {
      "symbol": "ETHA",
      "name": "",
      "pillar": "Sovereign Finance",
      "totalShares": 37,
      "totalBookValue": 1208.2405,
      "totalMarketValue": 1082.25,
      "avgPrice": 32.65514864864865,
      "pctPortfolio": 3.847591718654243,
      "targetPct": 7.91,
      "gapPct": -4.062408281345757,
      "accounts": [
        ""
      ]
    },
    {
      "symbol": "INTC",
      "name": "",
      "pillar": "ASI / Compute",
      "totalShares": 76,
      "totalBookValue": 2822.011574,
      "totalMarketValue": 2790.72,
      "avgPrice": 37.13173123684211,
      "pctPortfolio": 9.921507194347672,
      "targetPct": 32,
      "gapPct": -22.078492805652328,
      "accounts": [
        ""
      ]
    },
    {
      "symbol": "EQIX",
      "name": "",
      "pillar": "Data Infra / Supply Chain",
      "totalShares": 1,
      "totalBookValue": 792.746,
      "totalMarketValue": 815,
      "avgPrice": 792.746,
      "pctPortfolio": 2.897470317120082,
      "targetPct": 9.47,
      "gapPct": -6.572529682879919,
      "accounts": [
        ""
      ]
    },
    {
      "symbol": "SNPS",
      "name": "",
      "pillar": "ASI / Compute",
      "totalShares": 1.5,
      "totalBookValue": 664.786008,
      "totalMarketValue": 657.765,
      "avgPrice": 443.190672,
      "pctPortfolio": 2.3384718566140985,
      "targetPct": 32,
      "gapPct": -29.6615281433859,
      "accounts": [
        ""
      ]
    },
    {
      "symbol": "PSU.U.TO",
      "name": "",
      "pillar": "Other",
      "totalShares": 35,
      "totalBookValue": 3501.4000000000005,
      "totalMarketValue": 3508.05,
      "avgPrice": 100.04000000000002,
      "pctPortfolio": 12.471743246592764,
      "targetPct": 0,
      "gapPct": 12.471743246592764,
      "accounts": [
        ""
      ]
    },
    {
      "symbol": "HUMN",
      "name": "",
      "pillar": "Applied AI / Robotics",
      "totalShares": 26,
      "totalBookValue": 748.1948,
      "totalMarketValue": 770.9,
      "avgPrice": 28.776723076923076,
      "pctPortfolio": 2.740686953948308,
      "targetPct": 5.18,
      "gapPct": -2.4393130460516916,
      "accounts": [
        ""
      ]
    },
    {
      "symbol": "CEG",
      "name": "",
      "pillar": "Power / Energy",
      "totalShares": 3,
      "totalBookValue": 1119.026,
      "totalMarketValue": 1193.16,
      "avgPrice": 373.00866666666667,
      "pctPortfolio": 4.2418965442638,
      "targetPct": 10,
      "gapPct": -5.7581034557362,
      "accounts": [
        ""
      ]
    },
    {
      "symbol": "CORZ",
      "name": "",
      "pillar": "Data Infra / Supply Chain",
      "totalShares": 45,
      "totalBookValue": 844.9343999999999,
      "totalMarketValue": 877.05,
      "avgPrice": 18.77632,
      "pctPortfolio": 3.118069130834561,
      "targetPct": 9.47,
      "gapPct": -6.3519308691654395,
      "accounts": [
        ""
      ]
    },
    {
      "symbol": "CRWV",
      "name": "",
      "pillar": "Data Infra / Supply Chain",
      "totalShares": 3,
      "totalBookValue": 260.21085,
      "totalMarketValue": 424.47,
      "avgPrice": 86.73695,
      "pctPortfolio": 1.5090665343655965,
      "targetPct": 9.47,
      "gapPct": -7.960933465634405,
      "accounts": [
        ""
      ]
    },
    {
      "symbol": "USD_CASH",
      "name": "USD Cash (all accounts)",
      "pillar": "Cash",
      "totalShares": 3965.619441616745,
      "totalBookValue": 3965.619441616745,
      "totalMarketValue": 3965.619441616745,
      "avgPrice": 1,